{
  "$schema": "https://json-schema.org/draft/2020-12/schema",
  "type": "object",
  "required": [
    "serialization_profile",
    "schema_id",
    "schema_version",
    "proposal"
  ],
  "properties": {
    "serialization_profile": {
      "type": "string",
      "const": "ACS-1"
    },
    "schema_id": {
      "type": "string",
      "const": "anarchi.brain.proposal"
    },
    "schema_version": {
      "type": "string",
      "const": "1"
    },
    "proposal": {
      "type": [
        "object",
        "array",
        "string",
        "integer",
        "boolean"
      ]
    }
  },
  "additionalProperties": false
}
